#
# MDEV-38814: High rate of index_lock_upgrades due to
# btr_cur_need_opposite_intention() mostly returning true
#
# Test with simple table structure:
# Single INT primary key
# DATETIME column dt that starts not-NULL and gets updated to NULL
#
CREATE TABLE t1 (
id INT NOT NULL,
dt DATETIME NULL,
PRIMARY KEY (id)
) ENGINE=InnoDB;
INSERT INTO t1 (id, dt) SELECT seq, '2025-01-01' + INTERVAL seq SECOND FROM seq_1_to_100000;
# Rows inserted with not-NULL DATETIME
SELECT COUNT(*) AS rows_inserted FROM t1;
rows_inserted
100000
SELECT COUNT(DISTINCT dt) AS distinct_timestamps FROM t1;
distinct_timestamps
100000
# Index lock upgrades during inserts
SELECT @lu01 AS index_lock_upgrades_insert;
index_lock_upgrades_insert
0
SELECT @pu01 AS pessimistic_update_calls_insert;
pessimistic_update_calls_insert
0
SELECT @ou01 AS optim_err_underflows_insert;
optim_err_underflows_insert
0
SELECT @oo01 AS optim_err_overflows_insert;
optim_err_overflows_insert
0
SELECT @ps01 AS index_page_splits_insert;
index_page_splits_insert
772
SELECT @ma01 AS index_page_merge_attempts_insert;
index_page_merge_attempts_insert
0
SELECT @ms01 AS index_page_merge_successful_insert;
index_page_merge_successful_insert
0
SELECT @rs01 AS index_page_reorg_successful_insert;
index_page_reorg_successful_insert
0
SELECT @pd01 AS index_page_discards_insert;
index_page_discards_insert
0
# Now update all rows (batch update)
UPDATE t1 SET dt= NULL;
# Rows updated
SELECT COUNT(DISTINCT dt) AS distinct_timestamps FROM t1;
distinct_timestamps
0
# Index lock upgrades during updates
SELECT @lu12 AS index_lock_upgrades_update;
index_lock_upgrades_update
0
SELECT @pu12 AS pessimistic_update_calls_update;
pessimistic_update_calls_update
65
SELECT @ou12 AS optim_err_underflows_update;
optim_err_underflows_update
65
SELECT @oo12 AS optim_err_overflows_update;
optim_err_overflows_update
0
SELECT @ps12 AS index_page_splits_update;
index_page_splits_update
0
SELECT @ma12 AS index_page_merge_attempts_update;
index_page_merge_attempts_update
65
SELECT @ms12 AS index_page_merge_successful_update;
index_page_merge_successful_update
0
SELECT @rs12 AS index_page_reorg_successful_update;
index_page_reorg_successful_update
0
SELECT @pd12 AS index_page_discards_update;
index_page_discards_update
0
DROP TABLE t1;
